{
  "schema": "ae.state.v1",
  "id": "emoji-plugin-publication-pr19",
  "created_on": "2026-10-16",
  "environment": "CHAT^@GitHub / emoji plugin publication",
  "source": {
    "repository": "MYaelMendez/MYaelMendez.github.io",
    "pull_request": 19,
    "observed_head": "f7cd5b0b457d4f055701a27e42204d8233d3e41c"
  },
  "context": {
    "status": "blocked",
    "summary": "Website PR #19 draft, unmerged at last inspection. Canonical /emoji-plugins/ path and cautious privacy wording prepared. Not deployed or approved.",
    "blockers": [
      "Reported failed Cloudflare Workers check, root cause unverified",
      "Production host, data practices and public browser behavior unverified",
      "Publisher/legal approval pending"
    ]
  },
  "witness": {
    "url": "https://github.com/MYaelMendez/MYaelMendez.github.io/pull/19",
    "verification_scope": "Historical source and PR read-back only, not current deployment or provider verification"
  },
  "next_action": "Reinspect actual PR head, CI and Cloudflare evidence. Repair review branch with authorization. Do not merge, deploy or submit without explicit permission.",
  "authority": {
    "inherits": false,
    "requires_reauthorization": true
  }
}
